"EbayEnterprise_Address_Suggestions_Error_Message", "The address could not be validated. Please select one of the suggestions."
"EbayEnterprise_Address_No_Suggestions_Error_Message", "The address could not be validated. Please confirm the address is correct or enter a new address."
"EbayEnterprise_Address_Suggestions_Label", "Please choose one of the suggestions below."
"EbayEnterprise_Address_Suggested_Address_Label", "Use this address"
"EbayEnterprise_Address_Original_Address_Label", "Use original address"
"EbayEnterprise_Address_New_Address_Label", "Use a new address"
